label_name,model_task,label_type,label_family,label_definition_formula,reference_date_field,reference_price_field,horizon_trading_days,future_price_field_used,target_return_threshold,drawdown_threshold,comparison_operator,positive_condition,negative_condition,label_start_date_field,label_end_date_field,label_window_includes_effective_date_high_low,eligibility_field,validity_rule,observed_reference_label_measurement_allowed,observed_reference_overlap_handling,label_horizon_truncated_handling,post_target_handling,uses_high,uses_close,uses_low,label_direction,null_value_rule,used_for_training,used_for_validation,used_for_p1_gate
launch_winner_50h120,launch_winner_score,primary,winner,H_120(E)/P_E - 1 >= 0.50,stratum_effective_date,stratum_effective_price_reference,120,high,0.5,,>=,winner,not winner,event_effective_date,horizon_end_date_120d,True,launch_model_train_eval_eligible,label_measurement_available and not label_horizon_truncated,True,label measurement overlap allowed only for robustness audit,exclude from P1 promotion,,True,False,False,higher_is_positive,false when unavailable,True,True,True
launch_winner_50c120,launch_winner_score,secondary,winner,C_120(E)/P_E - 1 >= 0.50,stratum_effective_date,stratum_effective_price_reference,120,close,0.5,,>=,winner,not winner,event_effective_date,horizon_end_date_120d,True,launch_model_train_eval_eligible,label_measurement_available and not label_horizon_truncated,True,audit only,exclude from P1 promotion when overlap,,False,True,False,higher_is_positive,false when unavailable,False,True,False
launch_winner_100h240,launch_winner_score,audit,big_winner,H_240(E)/P_E - 1 >= 1.00,stratum_effective_date,stratum_effective_price_reference,240,high,1.0,,>=,big winner,not big winner,event_effective_date,horizon_end_date_240d,True,launch_model_train_eval_eligible,label_measurement_available and not label_horizon_truncated,True,audit only,exclude from P1 promotion when overlap,,True,False,False,higher_is_positive,false when unavailable,False,True,False
launch_false_positive_primary,launch_winner_score,audit,failure,not launch_winner_50h120 and L_60(E)/P_E - 1 <= -0.12,stratum_effective_date,stratum_effective_price_reference,60,mixed,,-0.12,<=,false positive,not false positive,event_effective_date,horizon_end_date_60d,True,launch_model_train_eval_eligible,label_measurement_available,True,audit only,exclude from P1 promotion when overlap,,True,False,True,lower_is_positive,false when unavailable,False,True,True
failure_reject_positive_primary,failure_reject_score,primary,failure,target_50h120 pending and no decision 50h120 and decision drawdown60 <= -0.12,failure_decision_effective_date,failure_decision_effective_price_reference,120,mixed,0.5,-0.12,mixed,reject positive,not reject positive,event_effective_date,decision_horizon_end_date_120d,True,failure_model_train_eval_eligible,target pending and label available,True,label measurement overlap allowed only for robustness audit,post-target rows audit only,post_target_risk_audit_only,True,False,True,higher_score_is_risk,false when unavailable,True,True,True
failure_false_reject_winner_from_launch_50h120,failure_reject_score,secondary,false_reject,target_50h120 reached after decision within original launch horizon,stratum_effective_date,stratum_effective_price_reference,120,high,0.5,,>=,false reject,not false reject,failure_decision_effective_date,target_50pct_high_date_120d,True,failure_model_train_eval_eligible,pending target only,True,P1 coverage gate reference,post-target rows audit only,,True,False,False,lower_is_better,false when unavailable,False,True,True
failure_false_reject_winner_from_decision_50h120,failure_reject_score,audit,secondary_veto,target pending and decision reference future 50h120,failure_decision_effective_date,failure_decision_effective_price_reference,120,high,0.5,,>=,false reject,not false reject,event_effective_date,decision_horizon_end_date_120d,True,failure_model_train_eval_eligible,secondary veto only,True,secondary veto,post-target rows audit only,,True,False,False,lower_is_better,false when unavailable,False,True,True
